{
  "icon": "storybound:waypoint/marker",
  "area_icon": "storybound:waypoint/area",
  "arrow": "storybound:waypoint/arrow",
  "size": 11,
  "text_color": "#F0E6D2",
  "distance_color": "#C9B48A",
  "name": "tracked",
  "distance": true,
  "fade_start": 96,
  "max_distance": 768,
  "hide_within": 4,
  "edge": "tracked"
}
